<?xml version="1.0" encoding="UTF-8"?>
<web-ext xmlns:xsi="http://www.w3.org/2001/XMLSchema-instance" xmlns="http://websphere.ibm.com/xml/ns/javaee" xsi:schemaLocation="http://websphere.ibm.com/xml/ns/javaee http://websphere.ibm.com/xml/ns/javaee/ibm-web-ext_1_0.xsd" version="1.0">

    <servlet name="Auto Servlet">
        <local-transaction boundary="BEAN_METHOD" resolver="CONTAINER_AT_BOUNDARY" unresolved-action="COMMIT"/>
    </servlet>  
  
    <reload-interval value="3"/>
    <enable-directory-browsing value="false"/>
    <enable-file-serving value="true"/>
    <enable-reloading value="true"/>
    <enable-serving-servlets-by-class-name value="true"/>

</web-ext>

